{
  "$defs": {
    "__schema0": {
      "anyOf": [
        {
          "type": "string"
        },
        {
          "type": "number"
        },
        {
          "type": "boolean"
        },
        {
          "type": "null"
        },
        {
          "items": {
            "$ref": "#/$defs/__schema0"
          },
          "type": "array"
        },
        {
          "additionalProperties": {
            "$ref": "#/$defs/__schema0"
          },
          "propertyNames": {
            "type": "string"
          },
          "type": "object"
        }
      ]
    },
    "__schema1": {
      "anyOf": [
        {
          "type": "string"
        },
        {
          "type": "number"
        },
        {
          "type": "boolean"
        },
        {
          "type": "null"
        },
        {
          "items": {
            "$ref": "#/$defs/__schema1"
          },
          "type": "array"
        },
        {
          "additionalProperties": {
            "$ref": "#/$defs/__schema1"
          },
          "propertyNames": {
            "type": "string"
          },
          "type": "object"
        }
      ]
    }
  },
  "$id": "urn:orca:migration-control-plane:source-cdc-trace.v1",
  "$schema": "https://json-schema.org/draft/2020-12/schema",
  "additionalProperties": false,
  "properties": {
    "createdAt": {
      "format": "date-time",
      "pattern": "^(?:(?:\\d\\d[2468][048]|\\d\\d[13579][26]|\\d\\d0[48]|[02468][048]00|[13579][26]00)-02-29|\\d{4}-(?:(?:0[13578]|1[02])-(?:0[1-9]|[12]\\d|3[01])|(?:0[469]|11)-(?:0[1-9]|[12]\\d|30)|(?:02)-(?:0[1-9]|1\\d|2[0-8])))T(?:(?:[01]\\d|2[0-3]):[0-5]\\d(?::[0-5]\\d(?:\\.\\d+)?)?(?:Z|([+-](?:[01]\\d|2[0-3]):[0-5]\\d)))$",
      "type": "string"
    },
    "events": {
      "items": {
        "additionalProperties": false,
        "properties": {
          "after": {
            "anyOf": [
              {
                "$ref": "#/$defs/__schema1"
              },
              {
                "type": "null"
              }
            ]
          },
          "afterDigest": {
            "anyOf": [
              {
                "pattern": "^[a-f0-9]{64}$",
                "type": "string"
              },
              {
                "type": "null"
              }
            ]
          },
          "beforeDigest": {
            "anyOf": [
              {
                "pattern": "^[a-f0-9]{64}$",
                "type": "string"
              },
              {
                "type": "null"
              }
            ]
          },
          "capturedAt": {
            "format": "date-time",
            "pattern": "^(?:(?:\\d\\d[2468][048]|\\d\\d[13579][26]|\\d\\d0[48]|[02468][048]00|[13579][26]00)-02-29|\\d{4}-(?:(?:0[13578]|1[02])-(?:0[1-9]|[12]\\d|3[01])|(?:0[469]|11)-(?:0[1-9]|[12]\\d|30)|(?:02)-(?:0[1-9]|1\\d|2[0-8])))T(?:(?:[01]\\d|2[0-3]):[0-5]\\d(?::[0-5]\\d(?:\\.\\d+)?)?(?:Z|([+-](?:[01]\\d|2[0-3]):[0-5]\\d)))$",
            "type": "string"
          },
          "entity": {
            "anyOf": [
              {
                "maxLength": 512,
                "minLength": 1,
                "type": "string"
              },
              {
                "type": "null"
              }
            ]
          },
          "key": {
            "anyOf": [
              {
                "additionalProperties": {
                  "anyOf": [
                    {
                      "type": "string"
                    },
                    {
                      "type": "number"
                    },
                    {
                      "type": "boolean"
                    }
                  ]
                },
                "propertyNames": {
                  "maxLength": 128,
                  "minLength": 1,
                  "type": "string"
                },
                "type": "object"
              },
              {
                "type": "null"
              }
            ]
          },
          "occurredAt": {
            "format": "date-time",
            "pattern": "^(?:(?:\\d\\d[2468][048]|\\d\\d[13579][26]|\\d\\d0[48]|[02468][048]00|[13579][26]00)-02-29|\\d{4}-(?:(?:0[13578]|1[02])-(?:0[1-9]|[12]\\d|3[01])|(?:0[469]|11)-(?:0[1-9]|[12]\\d|30)|(?:02)-(?:0[1-9]|1\\d|2[0-8])))T(?:(?:[01]\\d|2[0-3]):[0-5]\\d(?::[0-5]\\d(?:\\.\\d+)?)?(?:Z|([+-](?:[01]\\d|2[0-3]):[0-5]\\d)))$",
            "type": "string"
          },
          "operation": {
            "enum": [
              "snapshot-row",
              "snapshot-complete",
              "insert",
              "update",
              "delete",
              "truncate",
              "ddl",
              "heartbeat",
              "checkpoint"
            ],
            "type": "string"
          },
          "position": {
            "maxLength": 512,
            "minLength": 1,
            "type": "string"
          },
          "restartEpoch": {
            "maximum": 1000000,
            "minimum": 0,
            "type": "integer"
          },
          "resumeToken": {
            "anyOf": [
              {
                "maxLength": 512,
                "minLength": 1,
                "type": "string"
              },
              {
                "type": "null"
              }
            ]
          },
          "schemaVersion": {
            "maxLength": 128,
            "minLength": 1,
            "type": "string"
          },
          "sequence": {
            "exclusiveMinimum": 0,
            "maximum": 9007199254740991,
            "type": "integer"
          },
          "transactionId": {
            "anyOf": [
              {
                "maxLength": 256,
                "minLength": 1,
                "type": "string"
              },
              {
                "type": "null"
              }
            ]
          }
        },
        "required": [
          "sequence",
          "position",
          "transactionId",
          "restartEpoch",
          "operation",
          "entity",
          "key",
          "beforeDigest",
          "after",
          "afterDigest",
          "schemaVersion",
          "occurredAt",
          "capturedAt",
          "resumeToken"
        ],
        "type": "object"
      },
      "maxItems": 1000000,
      "minItems": 1,
      "type": "array"
    },
    "expectedFinalStateDigest": {
      "pattern": "^[a-f0-9]{64}$",
      "type": "string"
    },
    "id": {
      "maxLength": 128,
      "minLength": 18,
      "pattern": "^source_cdc_trace_[a-z0-9][a-z0-9_-]{0,111}$",
      "type": "string"
    },
    "initialState": {
      "items": {
        "additionalProperties": false,
        "properties": {
          "entity": {
            "maxLength": 512,
            "minLength": 1,
            "type": "string"
          },
          "key": {
            "additionalProperties": {
              "anyOf": [
                {
                  "type": "string"
                },
                {
                  "type": "number"
                },
                {
                  "type": "boolean"
                }
              ]
            },
            "propertyNames": {
              "maxLength": 128,
              "minLength": 1,
              "type": "string"
            },
            "type": "object"
          },
          "value": {
            "$ref": "#/$defs/__schema0"
          },
          "valueDigest": {
            "pattern": "^[a-f0-9]{64}$",
            "type": "string"
          }
        },
        "required": ["entity", "key", "value", "valueDigest"],
        "type": "object"
      },
      "maxItems": 1000000,
      "type": "array"
    },
    "kind": {
      "const": "source-cdc-trace",
      "type": "string"
    },
    "limitations": {
      "items": {
        "maxLength": 512,
        "minLength": 1,
        "type": "string"
      },
      "maxItems": 64,
      "type": "array"
    },
    "lineage": {
      "additionalProperties": false,
      "properties": {
        "capturedAt": {
          "format": "date-time",
          "pattern": "^(?:(?:\\d\\d[2468][048]|\\d\\d[13579][26]|\\d\\d0[48]|[02468][048]00|[13579][26]00)-02-29|\\d{4}-(?:(?:0[13578]|1[02])-(?:0[1-9]|[12]\\d|3[01])|(?:0[469]|11)-(?:0[1-9]|[12]\\d|30)|(?:02)-(?:0[1-9]|1\\d|2[0-8])))T(?:(?:[01]\\d|2[0-3]):[0-5]\\d(?::[0-5]\\d(?:\\.\\d+)?)?(?:Z|([+-](?:[01]\\d|2[0-3]):[0-5]\\d)))$",
          "type": "string"
        },
        "capturedBy": {
          "additionalProperties": false,
          "properties": {
            "id": {
              "maxLength": 128,
              "minLength": 1,
              "type": "string"
            },
            "kind": {
              "enum": ["system", "operator", "apex", "specialist", "evaluator", "adapter"],
              "type": "string"
            },
            "version": {
              "maxLength": 128,
              "minLength": 1,
              "type": "string"
            }
          },
          "required": ["kind", "id"],
          "type": "object"
        },
        "observationId": {
          "maxLength": 128,
          "minLength": 20,
          "pattern": "^source_observation_[a-z0-9][a-z0-9_-]{0,111}$",
          "type": "string"
        },
        "requestId": {
          "maxLength": 128,
          "minLength": 16,
          "pattern": "^source_request_[a-z0-9][a-z0-9_-]{0,111}$",
          "type": "string"
        },
        "snapshotToken": {
          "maxLength": 512,
          "minLength": 1,
          "type": "string"
        },
        "source": {
          "additionalProperties": false,
          "properties": {
            "databaseName": {
              "maxLength": 256,
              "minLength": 1,
              "type": "string"
            },
            "endpointDigest": {
              "pattern": "^[a-f0-9]{64}$",
              "type": "string"
            },
            "engine": {
              "maxLength": 128,
              "minLength": 1,
              "type": "string"
            },
            "engineVersion": {
              "maxLength": 128,
              "minLength": 1,
              "type": "string"
            },
            "fixtureDigest": {
              "anyOf": [
                {
                  "pattern": "^[a-f0-9]{64}$",
                  "type": "string"
                },
                {
                  "type": "null"
                }
              ]
            },
            "sourceSystemId": {
              "maxLength": 128,
              "minLength": 15,
              "pattern": "^source_system_[a-z0-9][a-z0-9_-]{0,111}$",
              "type": "string"
            }
          },
          "required": [
            "sourceSystemId",
            "engine",
            "engineVersion",
            "databaseName",
            "endpointDigest",
            "fixtureDigest"
          ],
          "type": "object"
        }
      },
      "required": [
        "source",
        "requestId",
        "observationId",
        "snapshotToken",
        "capturedAt",
        "capturedBy"
      ],
      "type": "object"
    },
    "schemaVersion": {
      "const": 1,
      "type": "number"
    },
    "tenantId": {
      "maxLength": 128,
      "minLength": 8,
      "pattern": "^tenant_[a-z0-9][a-z0-9_-]{0,111}$",
      "type": "string"
    },
    "traceVersion": {
      "maxLength": 128,
      "minLength": 1,
      "type": "string"
    }
  },
  "required": [
    "schemaVersion",
    "kind",
    "id",
    "tenantId",
    "createdAt",
    "lineage",
    "traceVersion",
    "initialState",
    "events",
    "expectedFinalStateDigest",
    "limitations"
  ],
  "title": "source-cdc-trace.v1",
  "type": "object",
  "x-orca-contract": {
    "registryVersion": 1,
    "runtimeInvariantValidationRequired": true,
    "schemaName": "source-cdc-trace.v1"
  }
}
