{
  "schemaVersion": 1,
  "kind": "source-cdc-trace",
  "id": "source_cdc_trace_pagila_qualification",
  "tenantId": "tenant_s1",
  "createdAt": "2026-01-01T00:10:00.000Z",
  "lineage": {
    "source": {
      "sourceSystemId": "source_system_pagila",
      "engine": "postgresql",
      "engineVersion": "16.15",
      "databaseName": "pagila",
      "endpointDigest": "bbbbbbbbbbbbbbbbbbbbbbbbbbbbbbbbbbbbbbbbbbbbbbbbbbbbbbbbbbbbbbbb",
      "fixtureDigest": "c22e7c170feafc06e70bee21771181e1880b5ef9c8ccc8567b093eeaf4fe025d"
    },
    "requestId": "source_request_pagila_cdc_qualification",
    "observationId": "source_observation_pagila_cdc_qualification",
    "snapshotToken": "snapshot-003",
    "capturedAt": "2026-01-01T00:10:00.000Z",
    "capturedBy": { "kind": "system", "id": "source-adapter-postgres", "version": "1" }
  },
  "traceVersion": "fixture-v1",
  "initialState": [],
  "events": [
    {
      "sequence": 1,
      "position": "001",
      "transactionId": null,
      "restartEpoch": 0,
      "operation": "snapshot-row",
      "entity": "public.actor",
      "key": { "actor_id": 1 },
      "beforeDigest": null,
      "after": { "actor_id": 1, "name": "A" },
      "afterDigest": "eccd905b58d59d0d03dffa419f19692f49687447c338391d13e93d21281b1e99",
      "schemaVersion": "1",
      "occurredAt": "2026-01-01T00:00:01.000Z",
      "capturedAt": "2026-01-01T00:00:01.500Z",
      "resumeToken": null
    },
    {
      "sequence": 2,
      "position": "002",
      "transactionId": null,
      "restartEpoch": 0,
      "operation": "snapshot-row",
      "entity": "public.actor",
      "key": { "actor_id": 2 },
      "beforeDigest": null,
      "after": { "actor_id": 2, "name": "B" },
      "afterDigest": "941e56294d406cbdb66ae773952776c858e4d1f74ef15378f6b93403944dba45",
      "schemaVersion": "1",
      "occurredAt": "2026-01-01T00:00:02.000Z",
      "capturedAt": "2026-01-01T00:00:02.500Z",
      "resumeToken": null
    },
    {
      "sequence": 3,
      "position": "003",
      "transactionId": null,
      "restartEpoch": 0,
      "operation": "snapshot-complete",
      "entity": null,
      "key": null,
      "beforeDigest": null,
      "after": null,
      "afterDigest": null,
      "schemaVersion": "1",
      "occurredAt": "2026-01-01T00:00:03.000Z",
      "capturedAt": "2026-01-01T00:00:03.500Z",
      "resumeToken": "snapshot-003"
    },
    {
      "sequence": 4,
      "position": "004",
      "transactionId": "tx-1",
      "restartEpoch": 0,
      "operation": "update",
      "entity": "public.actor",
      "key": { "actor_id": 1 },
      "beforeDigest": "eccd905b58d59d0d03dffa419f19692f49687447c338391d13e93d21281b1e99",
      "after": { "actor_id": 1, "name": "A2" },
      "afterDigest": "a78abed08d0b0144be12ff9c7c323922f11ea62488662c248b02a1c6fa713dda",
      "schemaVersion": "1",
      "occurredAt": "2026-01-01T00:00:04.000Z",
      "capturedAt": "2026-01-01T00:00:04.500Z",
      "resumeToken": null
    },
    {
      "sequence": 5,
      "position": "005",
      "transactionId": "tx-1",
      "restartEpoch": 0,
      "operation": "insert",
      "entity": "public.actor",
      "key": { "actor_id": 3 },
      "beforeDigest": null,
      "after": { "actor_id": 3, "name": "C" },
      "afterDigest": "a8e621eecc2fb63a8e4fd791a2682b1e19bdb1d399f443c162ac66e0aa0fc0f3",
      "schemaVersion": "1",
      "occurredAt": "2026-01-01T00:00:05.000Z",
      "capturedAt": "2026-01-01T00:00:05.500Z",
      "resumeToken": null
    },
    {
      "sequence": 6,
      "position": "006",
      "transactionId": "tx-2",
      "restartEpoch": 0,
      "operation": "delete",
      "entity": "public.actor",
      "key": { "actor_id": 2 },
      "beforeDigest": "941e56294d406cbdb66ae773952776c858e4d1f74ef15378f6b93403944dba45",
      "after": null,
      "afterDigest": null,
      "schemaVersion": "1",
      "occurredAt": "2026-01-01T00:00:06.000Z",
      "capturedAt": "2026-01-01T00:00:06.500Z",
      "resumeToken": null
    },
    {
      "sequence": 7,
      "position": "007",
      "transactionId": null,
      "restartEpoch": 0,
      "operation": "ddl",
      "entity": null,
      "key": null,
      "beforeDigest": null,
      "after": null,
      "afterDigest": null,
      "schemaVersion": "2",
      "occurredAt": "2026-01-01T00:00:07.000Z",
      "capturedAt": "2026-01-01T00:00:07.500Z",
      "resumeToken": null
    },
    {
      "sequence": 8,
      "position": "008",
      "transactionId": null,
      "restartEpoch": 0,
      "operation": "checkpoint",
      "entity": null,
      "key": null,
      "beforeDigest": null,
      "after": null,
      "afterDigest": null,
      "schemaVersion": "2",
      "occurredAt": "2026-01-01T00:00:08.000Z",
      "capturedAt": "2026-01-01T00:00:08.500Z",
      "resumeToken": "checkpoint-008"
    },
    {
      "sequence": 9,
      "position": "008",
      "transactionId": null,
      "restartEpoch": 1,
      "operation": "checkpoint",
      "entity": null,
      "key": null,
      "beforeDigest": null,
      "after": null,
      "afterDigest": null,
      "schemaVersion": "2",
      "occurredAt": "2026-01-01T00:00:09.000Z",
      "capturedAt": "2026-01-01T00:00:09.500Z",
      "resumeToken": "checkpoint-008"
    },
    {
      "sequence": 10,
      "position": "009",
      "transactionId": null,
      "restartEpoch": 1,
      "operation": "update",
      "entity": "public.actor",
      "key": { "actor_id": 3 },
      "beforeDigest": "a8e621eecc2fb63a8e4fd791a2682b1e19bdb1d399f443c162ac66e0aa0fc0f3",
      "after": { "actor_id": 3, "name": "C2" },
      "afterDigest": "b54f089949a28bf923d84a5c86f0525a8821111f2fbc5503ffa51ef287f1d3f0",
      "schemaVersion": "2",
      "occurredAt": "2026-01-01T00:00:05.000Z",
      "capturedAt": "2026-01-01T00:00:10.500Z",
      "resumeToken": null
    }
  ],
  "expectedFinalStateDigest": "a88f321bd17b1b74a81cb6b4fbf91eecbf8e681dabf18ae140e531845bcb1007",
  "limitations": [
    "Synthetic trace authored to exercise snapshot, transaction, delete, DDL, restart, duplicate, checkpoint and late-event behavior."
  ]
}
